{
  "$schema": "http://json-schema.org/draft-07/schema#",
  "type": "object",
  "properties": {
    "id": {
      "description": "Unique plan identifier",
      "type": "string",
      "pattern": "^aps-[a-f0-9]{8}$"
    },
    "hash": {
      "description": "SHA-256 hash of the plan content",
      "type": "string",
      "pattern": "^[a-f0-9]{64}$"
    },
    "intent": {
      "description": "Human-readable description of what this plan intends to achieve",
      "type": "string",
      "minLength": 10,
      "maxLength": 500
    },
    "schema_version": {
      "description": "Version of the APS schema",
      "type": "string",
      "const": "0.1.0"
    },
    "proposed_changes": {
      "description": "List of changes this plan will make",
      "type": "array",
      "items": {
        "type": "object",
        "properties": {
          "type": {
            "type": "string",
            "enum": [
              "file_create",
              "file_update",
              "file_delete",
              "config_update",
              "dependency_add",
              "dependency_remove",
              "dependency_update",
              "script_execute"
            ]
          },
          "path": {
            "description": "File or resource path affected by the change",
            "type": "string"
          },
          "description": {
            "description": "Human-readable description of the change",
            "type": "string"
          },
          "content": {
            "description": "New content for file changes",
            "type": "string"
          },
          "diff": {
            "description": "Unified diff for updates",
            "type": "string"
          },
          "metadata": {
            "description": "Additional change-specific metadata",
            "type": "object",
            "propertyNames": {
              "type": "string"
            },
            "additionalProperties": {}
          }
        },
        "required": ["type", "path", "description"],
        "additionalProperties": false
      }
    },
    "provenance": {
      "description": "Information about plan creation",
      "type": "object",
      "properties": {
        "timestamp": {
          "description": "ISO 8601 timestamp of plan creation",
          "type": "string",
          "format": "date-time",
          "pattern": "^(?:(?:\\d\\d[2468][048]|\\d\\d[13579][26]|\\d\\d0[48]|[02468][048]00|[13579][26]00)-02-29|\\d{4}-(?:(?:0[13578]|1[02])-(?:0[1-9]|[12]\\d|3[01])|(?:0[469]|11)-(?:0[1-9]|[12]\\d|30)|(?:02)-(?:0[1-9]|1\\d|2[0-8])))T(?:(?:[01]\\d|2[0-3]):[0-5]\\d(?::[0-5]\\d(?:\\.\\d+)?)?(?:Z))$"
        },
        "author": {
          "description": "User or system that created the plan",
          "type": "string"
        },
        "source": {
          "description": "Origin of the plan",
          "type": "string",
          "enum": ["cli", "api", "automation", "manual"]
        },
        "version": {
          "description": "Version of the tool that created the plan",
          "type": "string"
        },
        "repository": {
          "description": "Repository URL or identifier",
          "type": "string"
        },
        "branch": {
          "description": "Git branch name",
          "type": "string"
        },
        "commit": {
          "description": "Git commit hash",
          "type": "string"
        }
      },
      "required": ["timestamp", "source", "version"],
      "additionalProperties": false
    },
    "validations": {
      "description": "Validation requirements for this plan",
      "type": "object",
      "properties": {
        "required_checks": {
          "description": "List of required validation checks",
          "default": [],
          "type": "array",
          "items": {
            "type": "string"
          }
        },
        "policy_version": {
          "description": "Version of the policy bundle to use",
          "type": "string"
        },
        "skip_checks": {
          "description": "Checks to skip for this plan",
          "default": [],
          "type": "array",
          "items": {
            "type": "string"
          }
        },
        "custom_rules": {
          "description": "Custom validation rules",
          "type": "object",
          "propertyNames": {
            "type": "string"
          },
          "additionalProperties": {}
        }
      },
      "required": ["required_checks", "skip_checks"],
      "additionalProperties": false
    },
    "evidence": {
      "description": "Evidence from gate executions (immutable, append-only)",
      "type": "array",
      "items": {
        "type": "object",
        "properties": {
          "gate_version": {
            "description": "Version of the gate that ran",
            "type": "string"
          },
          "timestamp": {
            "description": "When the gate was executed",
            "type": "string",
            "format": "date-time",
            "pattern": "^(?:(?:\\d\\d[2468][048]|\\d\\d[13579][26]|\\d\\d0[48]|[02468][048]00|[13579][26]00)-02-29|\\d{4}-(?:(?:0[13578]|1[02])-(?:0[1-9]|[12]\\d|3[01])|(?:0[469]|11)-(?:0[1-9]|[12]\\d|30)|(?:02)-(?:0[1-9]|1\\d|2[0-8])))T(?:(?:[01]\\d|2[0-3]):[0-5]\\d(?::[0-5]\\d(?:\\.\\d+)?)?(?:Z))$"
          },
          "overall_status": {
            "description": "Overall gate result",
            "type": "string",
            "enum": ["passed", "failed", "partial"]
          },
          "checks": {
            "description": "Individual check results",
            "type": "array",
            "items": {
              "type": "object",
              "properties": {
                "check": {
                  "description": "Name of the check performed",
                  "type": "string"
                },
                "status": {
                  "description": "Result status",
                  "type": "string",
                  "enum": ["passed", "failed", "skipped", "warning"]
                },
                "timestamp": {
                  "description": "When the check was performed",
                  "type": "string",
                  "format": "date-time",
                  "pattern": "^(?:(?:\\d\\d[2468][048]|\\d\\d[13579][26]|\\d\\d0[48]|[02468][048]00|[13579][26]00)-02-29|\\d{4}-(?:(?:0[13578]|1[02])-(?:0[1-9]|[12]\\d|3[01])|(?:0[469]|11)-(?:0[1-9]|[12]\\d|30)|(?:02)-(?:0[1-9]|1\\d|2[0-8])))T(?:(?:[01]\\d|2[0-3]):[0-5]\\d(?::[0-5]\\d(?:\\.\\d+)?)?(?:Z))$"
                },
                "details": {
                  "description": "Detailed check results",
                  "type": "object",
                  "propertyNames": {
                    "type": "string"
                  },
                  "additionalProperties": {}
                },
                "message": {
                  "description": "Human-readable result message",
                  "type": "string"
                }
              },
              "required": ["check", "status", "timestamp"],
              "additionalProperties": false
            }
          },
          "summary": {
            "description": "Summary of gate execution",
            "type": "string"
          },
          "artifacts": {
            "description": "Links or references to artifacts",
            "type": "object",
            "propertyNames": {
              "type": "string"
            },
            "additionalProperties": {
              "type": "string"
            }
          }
        },
        "required": ["gate_version", "timestamp", "overall_status", "checks"],
        "additionalProperties": false
      }
    },
    "approval": {
      "description": "Approval information",
      "type": "object",
      "properties": {
        "approved": {
          "description": "Whether the plan is approved",
          "type": "boolean"
        },
        "approved_by": {
          "description": "User who approved the plan",
          "type": "string"
        },
        "approved_at": {
          "description": "When the plan was approved",
          "type": "string",
          "format": "date-time",
          "pattern": "^(?:(?:\\d\\d[2468][048]|\\d\\d[13579][26]|\\d\\d0[48]|[02468][048]00|[13579][26]00)-02-29|\\d{4}-(?:(?:0[13578]|1[02])-(?:0[1-9]|[12]\\d|3[01])|(?:0[469]|11)-(?:0[1-9]|[12]\\d|30)|(?:02)-(?:0[1-9]|1\\d|2[0-8])))T(?:(?:[01]\\d|2[0-3]):[0-5]\\d(?::[0-5]\\d(?:\\.\\d+)?)?(?:Z))$"
        },
        "approval_notes": {
          "description": "Notes or comments on approval",
          "type": "string"
        }
      },
      "required": ["approved"],
      "additionalProperties": false
    },
    "executions": {
      "description": "History of plan executions",
      "type": "array",
      "items": {
        "type": "object",
        "properties": {
          "operation": {
            "description": "Type of operation",
            "type": "string",
            "enum": ["apply", "rollback", "dry-run"]
          },
          "status": {
            "description": "Execution status",
            "type": "string",
            "enum": ["success", "failed", "partial"]
          },
          "timestamp": {
            "description": "When the operation was performed",
            "type": "string",
            "format": "date-time",
            "pattern": "^(?:(?:\\d\\d[2468][048]|\\d\\d[13579][26]|\\d\\d0[48]|[02468][048]00|[13579][26]00)-02-29|\\d{4}-(?:(?:0[13578]|1[02])-(?:0[1-9]|[12]\\d|3[01])|(?:0[469]|11)-(?:0[1-9]|[12]\\d|30)|(?:02)-(?:0[1-9]|1\\d|2[0-8])))T(?:(?:[01]\\d|2[0-3]):[0-5]\\d(?::[0-5]\\d(?:\\.\\d+)?)?(?:Z))$"
          },
          "executed_by": {
            "description": "User who executed the operation",
            "type": "string"
          },
          "changes_applied": {
            "description": "List of successfully applied changes",
            "type": "array",
            "items": {
              "type": "string"
            }
          },
          "changes_failed": {
            "description": "List of failed changes",
            "type": "array",
            "items": {
              "type": "string"
            }
          },
          "rollback_point": {
            "description": "Snapshot ID for rollback",
            "type": "string"
          },
          "logs": {
            "description": "Execution logs",
            "type": "array",
            "items": {
              "type": "string"
            }
          }
        },
        "required": ["operation", "status", "timestamp"],
        "additionalProperties": false
      }
    },
    "tags": {
      "description": "Tags for categorization and filtering",
      "type": "array",
      "items": {
        "type": "string"
      }
    },
    "metadata": {
      "description": "Additional plan-specific metadata",
      "type": "object",
      "propertyNames": {
        "type": "string"
      },
      "additionalProperties": {}
    }
  },
  "required": [
    "id",
    "hash",
    "intent",
    "schema_version",
    "proposed_changes",
    "provenance",
    "validations"
  ],
  "additionalProperties": false,
  "$id": "https://anvil.dev/schemas/aps/0.1.0/plan.json",
  "title": "Anvil Plan Specification (APS)",
  "description": "Schema for Anvil Plan Specification - a deterministic plan format for development automation",
  "version": "0.1.0"
}
